{
  "packVersion": "1.1.0",
  "contractId": "ON-WN-C1200-v1.0",
  "work": "Sigrdrífumál, stanzas 3–4",
  "profile": {
    "id": "west-norse-ca-1200",
    "label": "Classical Old West Norse (Old Icelandic), approximately 1200",
    "period": "approximately 1150–1250 CE",
    "region": "Old Icelandic literary tradition",
    "description": "A consistent teaching reconstruction based on the classical sound system, kept explicitly separate from Modern Icelandic pronunciation."
  },
  "sourceWitness": {
    "shelfmark": "GKS 2365 4to (Codex Regius of the Poetic Edda)",
    "workLocation": "Sigrdrífumál occupies fols. 31v25–32v34; the target is stanzas 3–4 in the modern division.",
    "note": "The pack follows the EAE manuscript edition and Pettit's normalized critical edition. It does not claim that normalized spelling reproduces the manuscript's spelling character for character."
  },
  "referenceAudio": {
    "manifest": "reference-audio/manifest.json",
    "analysis": "reference-audio/analysis.json",
    "attribution": "reference-audio/ATTRIBUTION.md",
    "styles": {
      "precise": {
        "label": "Precise teaching reference",
        "purpose": "Hear the contract's sound identities, stress, and phonemic length in a deliberately clear rendering.",
        "limitation": "Mechanically synthesized. It is a pronunciation aid, not a model of natural historical performance."
      },
      "naturalized": {
        "label": "Naturalized approximate reference",
        "purpose": "Hear the line with smoother timing and a more human-like Icelandic neural voice.",
        "limitation": "Uses a Modern Icelandic voice and does not define correctness. Where it conflicts with the contract, follow the precise reference and evidence ledger."
      }
    },
    "tempos": {
      "natural": {
        "label": "Natural speed",
        "purpose": "Normal reference playback."
      },
      "teaching": {
        "label": "Teaching tempo",
        "purpose": "Pitch-preserving 0.72× tempo for close listening."
      }
    }
  },
  "sources": [
    {
      "id": "eae-codex-regius",
      "kind": "manuscript-edition",
      "citation": "Editiones Arnamagnæanæ Electronicæ, GKS 2365 4to, Sigrdrífumál.",
      "url": "https://eae.ku.dk/q?form=register&p=eae%2Fvols%2Fstruct%2F369163",
      "accessed": "2026-09-29"
    },
    {
      "id": "pettit-2023",
      "kind": "critical-edition",
      "citation": "Edward Pettit, ed. and trans., The Poetic Edda: A Dual-Language Edition, Sigrdrífumál, pp. 519–536, Open Book Publishers, 2023, DOI 10.11647/OBP.0308.19.",
      "url": "https://www.openbookpublishers.com/books/10.11647/obp.0308/chapters/10.11647/obp.0308.19",
      "accessed": "2026-09-29"
    },
    {
      "id": "ut-austin-old-norse",
      "kind": "university-course",
      "citation": "Todd B. Krause and Jonathan Slocum, Old Norse Online, sections 1–2, Linguistics Research Center, University of Texas at Austin.",
      "url": "https://lrc.la.utexas.edu/eieol/norol/10",
      "accessed": "2026-09-29"
    },
    {
      "id": "barnes-2008",
      "kind": "academic-grammar",
      "citation": "Michael Barnes, A New Introduction to Old Norse, Part I: Grammar, 3rd ed., Viking Society for Northern Research, 2008, pp. 3–13.",
      "url": "https://vsnr.org/wp-content/uploads/2021/11/NION-1.pdf",
      "accessed": "2026-09-29"
    }
  ],
  "rules": [
    {
      "id": "profile-classical",
      "category": "profile",
      "statement": "Teach a reconstructed classical Old Norse system and keep it distinct from Modern Icelandic pronunciation.",
      "confidence": "high",
      "scorable": false,
      "evidence": [
        {"sourceId": "ut-austin-old-norse", "locator": "sections 1–2", "position": "Separates the classical period, approximately 1150–1350, from Modern Icelandic."},
        {"sourceId": "barnes-2008", "locator": "pp. 3–8", "position": "Describes substantial pronunciation change and presents an Old Norse system separately."}
      ]
    },
    {
      "id": "text-stanzas-3-4",
      "category": "text",
      "statement": "The target text is the normalized reading of Sigrdrífumál stanzas 3–4, divided into eight pedagogical verse lines.",
      "confidence": "high",
      "scorable": false,
      "evidence": [
        {"sourceId": "eae-codex-regius", "locator": "GKS 2365 4to, Sigrdrífumál", "position": "Supplies the manuscript transcription and normalized reading."},
        {"sourceId": "pettit-2023", "locator": "Sigrdrífumál 3–4, pp. 520–521", "position": "Supplies a recent normalized critical text and verse division."}
      ]
    },
    {
      "id": "vowel-qualities",
      "category": "vowel",
      "statement": "Use the classical vowel qualities /a e i o u y æ ɔ/ represented in the target words; keep front-rounded /y/ distinct.",
      "confidence": "high",
      "scorable": true,
      "evidence": [
        {"sourceId": "ut-austin-old-norse", "locator": "sections 1 and 2.2", "position": "Lists classical vowel values and organizes the vowel inventory."},
        {"sourceId": "barnes-2008", "locator": "section 2.1.1, pp. 8–9", "position": "Lists Old Norse pure-vowel qualities and contrasts."}
      ],
      "note": "Exact phonetic openness is less certain than the contrast itself."
    },
    {
      "id": "vowel-length",
      "category": "quantity",
      "statement": "Acute accents mark phonemic long vowels; long and short vowels must remain distinct.",
      "confidence": "high",
      "scorable": true,
      "evidence": [
        {"sourceId": "ut-austin-old-norse", "locator": "section 1", "position": "Pairs short and long values and describes long vowels as nearly twice the duration."},
        {"sourceId": "barnes-2008", "locator": "section 2.1.1, pp. 8–9", "position": "States that vowel length is normally indicated by an acute accent."}
      ]
    },
    {
      "id": "diphthongs",
      "category": "diphthong",
      "statement": "Treat ei and au in the target as long falling diphthongs rather than monophthongs.",
      "confidence": "high",
      "scorable": true,
      "evidence": [
        {"sourceId": "ut-austin-old-norse", "locator": "section 1 diphthong table", "position": "Lists au, ei, and ey as the three diphthongs."},
        {"sourceId": "barnes-2008", "locator": "section 2.1.2, pp. 9–10", "position": "Describes au, ei, and ey as long falling diphthongs."}
      ]
    },
    {
      "id": "consonant-core",
      "category": "consonant",
      "statement": "Use classical stop, nasal, liquid, sibilant, and glide identities rather than their later Modern Icelandic reflexes.",
      "confidence": "high",
      "scorable": true,
      "evidence": [
        {"sourceId": "ut-austin-old-norse", "locator": "sections 1 and 2.1", "position": "Provides the classical consonant values and inventory."},
        {"sourceId": "barnes-2008", "locator": "section 2.1.3, pp. 10–12", "position": "Provides the Old Norse spelling-to-consonant correspondences."}
      ]
    },
    {
      "id": "consonant-dentals",
      "category": "consonant",
      "statement": "Pronounce þ as /θ/ and ð as /ð/ in the teaching target.",
      "confidence": "high",
      "scorable": true,
      "evidence": [
        {"sourceId": "ut-austin-old-norse", "locator": "section 1 consonant table", "position": "Assigns voiceless and voiced English th-like values to þ and ð."},
        {"sourceId": "barnes-2008", "locator": "section 2.1.3, p. 11", "position": "Assigns thin-like þ and this-like ð values."}
      ]
    },
    {
      "id": "consonant-f",
      "category": "consonant",
      "statement": "Use [f] initially and a voiced [v]-like realization medially or finally for written f; long ff remains voiceless.",
      "confidence": "high",
      "scorable": true,
      "evidence": [
        {"sourceId": "ut-austin-old-norse", "locator": "section 1, f entries", "position": "Gives [f] initially and [v] medially or finally."},
        {"sourceId": "barnes-2008", "locator": "section 2.1.3, pp. 10–12", "position": "Gives the same positional distinction and keeps ff long and voiceless."}
      ]
    },
    {
      "id": "consonant-g",
      "category": "consonant",
      "statement": "Use [g] initially and after n, [x] before s or t, and [ɣ] elsewhere; [k] is accepted before s or t.",
      "confidence": "high",
      "scorable": true,
      "evidence": [
        {"sourceId": "ut-austin-old-norse", "locator": "section 1, g entries", "position": "Gives [g], [x], and voiced [ɣ] by environment."},
        {"sourceId": "barnes-2008", "locator": "section 2.1.3, pp. 11–12", "position": "Gives the same distribution and allows [k] before s or t."}
      ]
    },
    {
      "id": "consonant-n",
      "category": "consonant",
      "statement": "Use [ŋ] for n immediately before g or k and [n] elsewhere in the target.",
      "confidence": "high",
      "scorable": true,
      "evidence": [
        {"sourceId": "ut-austin-old-norse", "locator": "section 1, n entries", "position": "Gives the sing-like value before g or k."},
        {"sourceId": "barnes-2008", "locator": "section 2.1.3, pp. 11–12", "position": "Gives [ŋ] before g or k while retaining the following stop."}
      ]
    },
    {
      "id": "consonant-r",
      "category": "consonant",
      "statement": "Use an alveolar trill [r]; an alveolar tap [ɾ] is an accepted teaching variant.",
      "confidence": "high",
      "scorable": true,
      "evidence": [
        {"sourceId": "ut-austin-old-norse", "locator": "sections 1 and 2.1", "position": "Describes r as trilled."},
        {"sourceId": "barnes-2008", "locator": "section 2.1.3, p. 11", "position": "Describes r as rolled."}
      ],
      "note": "The tap is a pedagogical allowance, not a separately reconstructed phoneme."
    },
    {
      "id": "consonant-v-disputed",
      "category": "consonant",